{
  "artifact_conventions": [
    {
      "content": "Deliverable: custody decision JSON. Required fields: batch_id, controlling_seals, disposition, reason, observation_ids.",
      "item_id": "epsilon-artifact-e-a1",
      "proposition_basis": [
        "E-P1",
        "E-P2",
        "E-P3",
        "E-P4"
      ],
      "source_object_id": "E-A1"
    }
  ],
  "claim_ceiling": {
    "agent_capability": false,
    "expert_provenance": false,
    "production_fitness": false,
    "professional_validity": false,
    "readiness": false,
    "transfer": false,
    "utility": false
  },
  "clauses": [
    {
      "clause_id": "epsilon-e-p1",
      "instruction": "Group observations by batch identifier and retain every supplied observation in the custody ledger.",
      "proposition_basis": [
        "E-P1"
      ]
    },
    {
      "clause_id": "epsilon-e-p2",
      "instruction": "When records disagree, a signed scan outranks an unsigned note, but only within the record scope and valid-time window.",
      "proposition_basis": [
        "E-P2"
      ]
    },
    {
      "clause_id": "epsilon-e-p3",
      "instruction": "Release a batch only when every required seal has a controlling intact observation no older than 24 hours at review time.",
      "proposition_basis": [
        "E-P3"
      ]
    },
    {
      "clause_id": "epsilon-e-p4",
      "instruction": "Quarantine any batch with an unresolved missing, broken, expired, or equally authoritative conflicting seal observation.",
      "proposition_basis": [
        "E-P4"
      ]
    }
  ],
  "contradictions": [
    {
      "content": "Authority resolves unequal conflicts; equal-authority conflict remains unresolved and requires quarantine.",
      "item_id": "epsilon-contradiction-e-c1",
      "proposition_basis": [
        "E-P2",
        "E-P4"
      ],
      "source_object_id": "E-C1"
    }
  ],
  "failure_signatures": [
    {
      "content": "unsigned note overrides an in-scope valid signed scan",
      "item_id": "epsilon-failure-e-f1",
      "proposition_basis": [
        "E-P2"
      ],
      "source_object_id": "E-F1"
    },
    {
      "content": "batch releases with expired, broken, missing, or unresolved seal evidence",
      "item_id": "epsilon-failure-e-f2",
      "proposition_basis": [
        "E-P3",
        "E-P4"
      ],
      "source_object_id": "E-F2"
    }
  ],
  "generation_context": {
    "generation_attempt": 1,
    "generator_kind": "builder_reference_source_only",
    "source_only": true,
    "task_context_visible": false,
    "visible_inputs": [
      "corpus.json",
      "interface-guide.md",
      "example-source.json",
      "example-package.json"
    ]
  },
  "omissions": [],
  "package_id": "epsilon-reference",
  "package_version": "1.0.0",
  "proposition_bindings": [
    {
      "clause_ids": [
        "epsilon-e-p1"
      ],
      "proposition_id": "E-P1",
      "transformation": "verbatim"
    },
    {
      "clause_ids": [
        "epsilon-e-p2"
      ],
      "proposition_id": "E-P2",
      "transformation": "verbatim"
    },
    {
      "clause_ids": [
        "epsilon-e-p3"
      ],
      "proposition_id": "E-P3",
      "transformation": "verbatim"
    },
    {
      "clause_ids": [
        "epsilon-e-p4"
      ],
      "proposition_id": "E-P4",
      "transformation": "verbatim"
    }
  ],
  "schema_version": "0.1.0",
  "source_identity": {
    "family_id": "family-epsilon",
    "family_version": "1.0.0",
    "source_corpus_sha256": "d12870208a04822edd1e5b0a334c11e562bd0f9e71c4669e8124b26cce600554"
  },
  "thresholds": [
    {
      "content": "review_time_hours - controlling_observation_time_hours <= 24",
      "item_id": "epsilon-threshold-e-t1",
      "proposition_basis": [
        "E-P3"
      ],
      "source_object_id": "E-T1"
    }
  ]
}
