{
  "schema_version": "0.1.0",
  "package_id": "family-alpha-source-only-reference",
  "package_version": "0.1.0",
  "source_identity": {
    "family_id": "family-alpha",
    "family_version": "1.0.0",
    "source_corpus_sha256": "a1aa793192ca2f96e12aac826df452c48bbfdc47eff41f9b3cc9dd789c2f8489"
  },
  "generation_context": {
    "generator_kind": "builder_reference_source_only",
    "source_only": true,
    "task_context_visible": false,
    "generation_attempt": 1,
    "visible_inputs": ["pilots/pretask-procedure-transfer-v2/families/evidence-decision/corpus.json"]
  },
  "proposition_bindings": [
    {"proposition_id": "A-P1", "clause_ids": ["eligibility"], "transformation": "bounded_paraphrase"},
    {"proposition_id": "A-P2", "clause_ids": ["supersession"], "transformation": "bounded_paraphrase"},
    {"proposition_id": "A-P3", "clause_ids": ["decision-gate"], "transformation": "bounded_paraphrase"},
    {"proposition_id": "A-P4", "clause_ids": ["reconcile"], "transformation": "bounded_paraphrase"}
  ],
  "clauses": [
    {"clause_id": "eligibility", "instruction": "Count only records whose issuer, scope, and valid time fit the decision.", "proposition_basis": ["A-P1"]},
    {"clause_id": "supersession", "instruction": "Use recency as supersession only for the same subject and scope; otherwise retain the discrepancy.", "proposition_basis": ["A-P2"]},
    {"clause_id": "decision-gate", "instruction": "Proceed only with two independent eligible supports and no unresolved eligible blocker; otherwise hold and name resolving evidence.", "proposition_basis": ["A-P3"]},
    {"clause_id": "reconcile", "instruction": "Record every supplied item with eligibility, role, and decision effect.", "proposition_basis": ["A-P4"]}
  ],
  "omissions": [
    {"source_kind": "failure_signature", "source_object_id": "A-F3", "reason_kind": "not_applicable_to_package_scope", "rationale": "The package specifies the complete-register convention directly; this compact reference does not duplicate the corresponding diagnostic phrase."}
  ],
  "contradictions": [
    {"item_id": "authority-before-recency", "source_object_id": "A-C1", "proposition_basis": ["A-P1", "A-P2"], "content": "Recency does not cure invalid authority or scope, and cross-scope conflict remains unresolved."}
  ],
  "thresholds": [
    {"item_id": "proceed-gate", "source_object_id": "A-T1", "proposition_basis": ["A-P3"], "content": "Proceed requires at least two independent eligible supports and zero unresolved eligible blockers."}
  ],
  "artifact_conventions": [
    {"item_id": "memo-register", "source_object_id": "A-A1", "proposition_basis": ["A-P4"], "content": "Produce a decision memo and complete evidence register containing recommendation, rationale, record identity, eligibility, role, effect, and resolving evidence."}
  ],
  "failure_signatures": [
    {"item_id": "ineligible-support", "source_object_id": "A-F1", "proposition_basis": ["A-P1"], "content": "Wrong-scope or expired evidence is counted as eligible."},
    {"item_id": "recency-erasure", "source_object_id": "A-F2", "proposition_basis": ["A-P2"], "content": "Recency erases a cross-scope contradiction."}
  ],
  "claim_ceiling": {
    "expert_provenance": false,
    "professional_validity": false,
    "transfer": false,
    "agent_capability": false,
    "utility": false,
    "production_fitness": false,
    "readiness": false
  }
}
